Uniq Id;Product Name;List Price;Brand;Category;Position x;Position y
624a11cdbea633853135a08f7eac832f;Small Pet Dog Cat Dresses Clothes Princess Skirt Bowknot Flower;6.49;Unique Bargains;Pets;0;0
67401f90a113b9b4bb676a64c8df87ef;(24 Pack) Friskies Wet Cat Food, Shreds With Whitefish & Sardines in Sauce, 5.5 oz. Cans;15.98;Friskies;Pets;0;1
c7e1608fcc72f77ef0dc47a137e834e5;(24 Pack) Friskies Flaked with Tuna Cat Food, 5.5 oz. Cans;19.98;Friskies;Pets;0;2
79df370b7e10117457715287c0ab4e27;Educator EZ-902 Two Dog Easy 1/2 Mile E-Collar Remote Dog Training Collar With Vibration, Tapping Sensation and Pavlovian Stimulation;411.91;E-Collar Technologies;Pets;0;3
58c1bb96182014afffead5d8ad1d5872;OTVIAP Dog Bike Trailer Lassie Red;140.65;OTVIAP;Pets;0;4
7802f52ddd836d02a135f8d7a3022fd5;WALFRONT Dog Bike Trailer Red and Black;138.99;WALFRONT;Pets;0;5
935bf42eb81578ece02b7fd61bb34510;Car Auto Dog Front Seat Cover Gray Pet Scratch-proof Seat Cover Protector;24.11;Unique Bargains;Pets;1;0
d82160f130517befeb34cb58d5607888;"K&H Pet Products Buckle n Go Pet Seat Small Gray 21"" x 13"" x 19""";41.5;K&H Pet Products;Pets;1;1
7409882e499e82818902dc1537e178c7;Pet Dog Booster Car Seat Safe Basket Puppy Travel Auto Carrier Bag Pet Supply, Car Seat Safe Basket;19.25;Ejoyous;Pets;1;2
a5a2713679864b9067aacb7e3e30c921;Collapsible Pet Dog Booster Car Seat Cat Car Carrier And Zipper Storage Pocket;41.91;;Pets;1;3
023283b981b8906dbace237db4ddb317;Portable Foldable Pets Dogs Cats Car Crate Lookout Booster Seat Bag Carrier Travel Outdoor Pets Beds Geometric Pattern;27.72;;Pets;1;4
e1e9df14c1ca21959c683817ccd2099d;"Titan Chain Training Dog Collar-Chrome 3.0mm, Neck Size 22""";9.99;Coastal Pet Products;Pets;1;5
ec37e04c4c6888d7645f292ba3d62d2f;200C 1-Dog Trainer;235.6;Dogtra;Pets;2;0
31815aeb9296c82f6f8f16e59fedfda3;PE-902 2 Dog Pro Educator 1/2 Mile Advanced Training System;339;Pro-Educator;Pets;2;1
6ac1a53ef2a72f61ae4ea886014c1212;DT Systems H2O 1820 PLUS H2O 1820 PLUS 1 Dog System;223.83;DT Systems;Pets;2;2
cdb70398e9f4a06897132c0349e629c3;282C 2-dog;396.77;Dogtra;Pets;2;3
ee275e43e259f8e5dde1476c179f1eac;"Heavy Duty Dog Fence Receiver 1"" Nylon 3 Hole Replacement Strap, Teal";19.99;Sparky PetCo;Pets;2;4
dc9f68ac200d81987d7fd3601352b7d7;Smart Dog Trainer;127.04;Smart;Pets;2;5
74c683945d67ff4da49823228991c97d;Vet Kem Siphotrol Plus Spray 24 oz;22.61;Vet Kem;Pets;3;0
4855881912e08d71fe5f5f5c9c6fb710;Enforcer 2pk Flea Fogger;9.84;Enforcer;Pets;3;1
acdb9ddeba16fc1c315a7f4129c45711;Greenies Pill Pockets Capsule Size Dog Treats Chicken Flavor, 7.9 oz. Pack (30 Treats);7.98;Greenies;Pets;3;2
7d7bbf696fb466ca898645a6e72a2170;Purina Dog Chow Dry Dog Food, Complete Adult With Real Chicken, 50 lb. Bag;22.98;Dog Chow;Pets;3;3
ecdd931ff737de704d6f5e669b39b45a;Advocate PetTest Twist Top Sterile Lancets Dog & Cat Supplement, 50 Ct;5.83;Advocate;Pets;3;4
db429b13e9c70c29e858d7623240f8cb;Life by TropiClean Skin & Coat Aid Dog Supplement, 2.5 oz;14.97;Tropiclean;Pets;3;5
d99d4288046b7744d05b87301d5d0030;Unique Sports Dog Fetch Balls, Animal Print, 18 Pack;12.89;Unique Sports;Pets;4;0
aa3c181828a95d6077ca91fb54fe791b;Chuckit! Ultra Ball Durable Dog Toys, Medium, 2-Pack;7.95;Chuckit!;Pets;4;1
9aad472d631fff7be01a3996cd6cfad9;Coastal Pet Remington Deluxe Whistle;11.83;Coastal Pet Products;Pets;4;2
3a27ecc9838f2b986b9ba97bb709a82e;Unique Bargains Stripe Pattern Bell Decor Pet Dog Doggy Adjustable Bowtie Collar White Beige;5.81;Unique Bargains;Pets;4;3
9ae27d25f2496462f0663ab1642d1d8a;Downtown Pet Supply Dog E Bark Shock Training Collar for Small and Large Dogs - Rechargeable Remote Collar with Vibrate, Tone, and Static - Stop Barking Collar - 330 Yard Range with 100 Levels;28.99;Downtown Pet Supply;Pets;4;4
95d42a57da9d58f4af45a25aa54ca923;Cameron Sino 3400mAh Battery for Garmin DC50, DC50 Dog Tracking Collar, Alpha, TT10 Dog Device, Alpha 100, TT10, TT 10 dog tracking, TT 10 training device and others;19.69;Cameron Sino;Pets;4;5
d4d1a8e098c58ce2e4b5480900bef42d;"Titan Prong Training Collar - 14"" = Fine 2.0 mm, Titan Chain will not tarnish, rust or break. By Coastal Pet";18.29;Coastal Pet;Pets;5;0
7b205988fb04010305add809314d3478;2000 Meter Remote Dog Training Shock Collar Hunting Trainer Waterproof Rechargeable;98.95;GROOVYPETS;Pets;5;1
f02c49f1f9a0869fc94f3271e2997d7a;PetSpy M86N Dog Training Shock Collar for Dogs with Vibration Electric Shock and Beep Rechargeable and Waterproof Remote Trainer (10-140 lbs);49.99;PetSpy;Pets;5;2
d52af3470f9ae0a982ac7bfdcc4e018a;DT Systems Add-On or Replacement Dog Training Collar Receiver, Fluorescent Green;119.91;D.T. Systems*;Pets;5;3
8b2514fa94a17781bb450ea5ab935210;Gentle Leader Head Collar Dog Training Guide Walk Anti Pull Choose Size & Color (Black,Petite - Under 5lbs);36.89;MPP;Pets;5;4
f4aad5f0eb90dfecb7b9a097d18e626c;Dog Training Collar System, Remote-Controlled, 100-Yd.;118.03;RADIO SYSTEMS;Pets;5;5
6038fcf2b8aa09c58e235be2d65b894f;Gentle Leader Head Collar Dog Training Guide Walk Anti Pull Choose Size & Color (Royal Blue,xLarge - Over 130lbs);36.89;MPP;Pets;6;0
f9b95d0f93dfcee499240f0821510d61;iPets PET619S-2 Dog Training Collar Upgraded Version Remote Dog Shock Collar Rechargeable & Waterproof with Beep Vibrating Electric Shock Collar for All Size Dogs (10-100lbs);49.99;iPets;Pets;6;1
91cc5620e4ada89378ff479b071a447b;Ownpets Dog Training Collar Pet Trainer 100 Levels Static Shock, Rechargeable Waterproof 330 Yard with Remote;24.99;Ownpets;Pets;6;2
c1fa5f4c6c6de2276c555bb176ac5031;Remote Dog Training Collar 330 Yard Radius LCD 100LV Shock Pet Bark;36.95;Paws & Pals;Pets;6;3
a5e1de85436c8aa52d4da156f15dbd3e;Petrainer PET852-A Pet Dog Shock Collar Anti Barking Control E-Collar;10.99;Petrainer;Pets;6;4
130caddc9a3b32453afdb0e4d8633a00;HQRP Battery for Dogtra 150NCP COLLAR / 7002M COLLAR / DA009 / YS-200 / YS-500 / YS-500 YAPPER Remote Controlled Dog Training Collar Receiver + HQRP Coaster;10.3;HQRP;Pets;6;5
f4c8e915a4193c70272568e04a317f49;Pet Dog 880 Yard Remote Trainer with Tone/Beep and 99 Levels of Static - Rechargeable, Easy-to-Use Dog Training System, Waterproof Design (1 Remote Transmitter+2 Collars);41.99;Hosim;Pets;7;0
189c94fc9eac5c82be600ab82ebe6b17;"ET-800 1 Dog ""The Boss"" E-Collar 1 Mile Big Dog Remote Trainer";348.96;Educator;Pets;7;1
83d6f418b0fe54a7314f860d94a9328d;Waterproof Dog Training Electric Collar Rechargeable Remote Control 875 Yards;39.99;myriann;Pets;7;2
42770d2216e853437fb0b8ea6a1821c8;CoastaCloud Anti Bark Adjustable 6 Levels Sensitivity Control No Barking Collar for Dog Pets Training Adjustable Control Shock ,Stop parking;12.69;CoastaCloud;Pets;7;3
876c00360b39fc83bad0c0e879b0db3a;(3 Pack) Herm. Sprenger Prong Collar Extra Links, 2.25 mm, Includes 3 links. Safe, effective dog training tools with proper use. By Herm Sprenger;11.89;Herm Sprenger;Pets;7;4
8f40d56e94030914b15d88310e05b750;CoastaCloud Electric Remote Rechargeable and Waterproof collar NO Barking Anti Bark for Dogs Pet Training collars Shock Collar for 1 Dog or 2 Dogs,Two types selected;42.99;CoastaCloud;Pets;7;5
d37f741a808377c04cf3e16c4a9a10ca;Petrainer PET998DR2-A Dog Training Collar Rechargeable Dog E-Collar LCD 100LV Remote Shock Collar Rainproof Electric Dog Shock Collar for 2 Dogs;33.99;Petrainer;Pets;8;0
ba1dcd2da66fd6c80ed4076a2e4b8d0a;Coastal Pet Products Herm. Sprenger Extra Links for Dog Prong Collars 2.25mm Silver;10.44;Herm. Sprenger;Pets;8;1
5827849b54ba4cf948df71c526d5afaa;998DC Waterproof Rechargeable Remote Electric Shock Anti-Bark Dog Training Collar;23.03;;Pets;8;2
231954c5c96bec1bfe01f24ccc78d50b;Garmin TB 10 Additional PRO Trashbreaker Dog Collar Red Red;199.99;Garmin;Pets;8;3
b28a2545f0ab47267e9bd0b7a58e3467;OTVIAP LCD Electric 100LV Levels Shock Vibra Pet Dog Training Remote Control E-Collar;25.52;OTVIAP;Pets;8;4
07fd9b84aa6f95a3bf51da15599ad974;Digoo DG-PPT1 Dog Traning Collar Trainer - LCD Electric Remote -100LV Shock Pet Bark - XXS, XS, S, M, L, XL, XXL - Waterproof Rechargeable;25.66;Digoo;Pets;8;5
e58198c65653c401632693fad50cd162;Aetertek AT-919C 1000M Remote 1- Dog Training Shock Collar Auto Anti Bark Submersible with LCD display;79.99;AETERTEK;Pets;9;0
2260635ebff1d586fe618bc2df9b8fde;PetSpy 1100 Yards Remote Dog Training Shock Collar for Dogs with Beep, Vibration and Electric Shock, Rechargeable and Waterproof E-Collar Trainer;46.54;PetSpy;Pets;9;1
e233e503f548de0604b6fbd2d4a799dd;Anauto LCD Electric 100LV Levels Shock Vibra Pet Dog Training Remote Control E-Collar;25.19;Anauto;Pets;9;2
40d5d73a0fa88fdff851065fc807a949;Dogtra Hunter Platinum System 1 Dog Training Collar;217.14;Dogtra;Pets;9;3
466d6141fbee414341e66e6bfcbf9e87;Coastal Pet Products Herm. Sprenger Ultra-Plus Prong Dog Training Collar with Latch 3.0mm Silver;26.77;Herm Sprenger;Pets;9;4
651aa80317a65b9439030a6c6aab67dc;650 Yard Remote Dog Training Shock Collar Hunting Trainer Waterproof Rechargeable;59.95;GROOVYPETS;Pets;9;5
ed44afb33097ca3c76be0130aabbf47e;Dog Training Shock Collar,Waterproof Dog Shock Collar,1000 ft Remote Anti Bark Dog Training Collar,Dog Bark Collar for Small Medium Large Dogs With LCD Display,White;29.99;VINSIC;Pets;10;0
eb49111e38413dffc2b981bd59035cd9;Petness Waterproof TPU Electric Remote Training Collar for 2 Dogs;143.53;Petness;Pets;10;1
978f32bcea533215d4aa47dba651ab0c;Yosoo LCD Electric 100LV Levels Shock Vibra Pet Dog Training Remote Control E-Collar;33.15;Yosoo;Pets;10;2
6e436b72404269147ef464a5dfe291cc;Steel Dog Training Collar, 20-Inch, Fine 2.0 Millimeter, High-quality chain By Herm Sprenger;16.99;Herm Sprenger;Pets;10;3
4804d949d50cf8b85fc197da54367603;3-Dog Training Set: 600 YARD REMOTE DOG TRAINER WITH WATERPROOF RECHARGEABLE DOG TRAINING SHOCK COLLAR: 7 ADUSTABLE SHOCK LEVELS PLUS BEEP TONE AND VIBRATION FOR ONE DOG TRAINING;99.99;Aetertek;Pets;10;4
c8b68cd25ff4435002d5bef60b2e10ab;KOOLKANI 650 Yards Remote 1 Dog Training Collar Obedience Trainer:Rechargeable Waterproof Collar w/10 Levels of Adjustable Static Stimulation,Beep Tone and Vibration;65.95;Koolkani;Pets;10;5
89387c4dcaecdb7267a1d788f421e512;Beef Cattle Weigh Tape from Coburn;11.98;The Coburn Company Inc;Pets;11;0
c64c89fc94349a77b247dd6700499934;Mane N Tail Herbal Grow Shampoo, 12 oz.;4.28;Mane n Tail;Pets;11;1
e12634c45ae21cceece89f3b894c1c31;Marcal Eco-Pac White Interfolded Dry Wax Paper, 500 count, Pack of 12);78.87;Marcal;Pets;11;2
f67beb586e09ca968302b4d7b0898cec;Durvet Inc D-Bloat Treatment 12 Ounce;14.07;DURVET INC D;Pets;11;3
2623ca9ffe95b652d95fa31b41b82239;Equine Couture Ocala All Purpose Saddle Pad Black;19.98;Equine Couture;Pets;11;4
7284830a38c7c0975edcbf3eca53a34c;Odor Eaters Stink Stoppers for Kids and Teens, Odor-Killing Dry Spray, 4 Oz;4.23;Odor-Eaters;Pets;11;5
8a6b4a5b92650f0ce17ec7a9616a8890;Exo-Terra Mister Bottle 16 fl oz - Pack of 12;42.99;Exo-Terra;Pets;12;0
941f3ff94519d4eda6a54bdc1fe83cce;Zoo Med MD-30 Repti Turtle Eye Drops, 2.25 fl oz Bottle;7.65;Zoo Med;Pets;12;1
